{
  "$schema": "https://json-schema.org/draft/2020-12/schema",
  "title": "Shared Lean export configuration v1",
  "type": "object",
  "additionalProperties": false,
  "required": ["schemaVersion"],
  "properties": {
    "schemaVersion": {"const": 1},
    "package": {"$ref": "#/$defs/metadata"},
    "modules": {"$ref": "#/$defs/selection"},
    "exports": {"$ref": "#/$defs/selection"},
    "resources": {"$ref": "#/$defs/names"},
    "ownedAggregates": {"$ref": "#/$defs/ownedAggregates"},
    "arities": {"type": "object", "propertyNames": {"$ref": "#/$defs/name"}, "additionalProperties": {"type": "integer", "minimum": 0, "maximum": 32}},
    "specializations": {"$ref": "#/$defs/specializations"},
    "contracts": {"$ref": "#/$defs/contracts"},
    "generators": {"$ref": "lake-generator-configuration.schema.json"},
    "targets": {
      "type": "object",
      "additionalProperties": false,
      "properties": {
        "npm": {
          "type": "object",
          "additionalProperties": false,
          "properties": {
            "name": {
              "type": "string", "maxLength": 214,
              "pattern": "^(?:[a-z0-9][a-z0-9._-]*|@[a-z0-9._-]+/[a-z0-9._-]+)$(?![\\s\\S])",
              "not": {"anyOf": [
                {"enum": ["node_modules", "favicon.ico", "@lean-bridge/runtime"]},
                {"pattern": "^@\\.{1,2}/|/\\.{1,2}$"}
              ]}
            },
            "version": {
              "type": "string", "maxLength": 256,
              "description": "Exact npm version. Build metadata is rejected because npm strips it when publishing.",
              "not": {"pattern": "\\+"},
              "pattern": "^(0|[1-9][0-9]*)\\.(0|[1-9][0-9]*)\\.(0|[1-9][0-9]*)(?:-((?:0|[1-9][0-9]*|[0-9]*[A-Za-z-][0-9A-Za-z-]*)(?:\\.(?:0|[1-9][0-9]*|[0-9]*[A-Za-z-][0-9A-Za-z-]*))*))?(?:\\+[0-9A-Za-z-]+(?:\\.[0-9A-Za-z-]+)*)?$(?![\\s\\S])"
            }
          }
        },
        "pypi": {"$ref": "#/$defs/package"},
        "cargo": {"$ref": "#/$defs/package"},
        "c": {"$ref": "#/$defs/package"},
        "cpp": {"$ref": "#/$defs/package"},
        "nuget": {"$ref": "#/$defs/package"},
        "maven": {"$ref": "#/$defs/package"},
        "rubygems": {"$ref": "#/$defs/package"},
        "cpan": {
          "type": "object",
          "additionalProperties": false,
          "properties": {
            "module": {"type": "string", "pattern": "^LeanBridge::[A-Za-z][A-Za-z0-9_]*(::[A-Za-z][A-Za-z0-9_]*)*$"},
            "version": {"type": "string", "pattern": "^[0-9]+\\.[0-9]{3}(_[0-9]{2})?$"}
          }
        },
        "php-native": {"$ref": "#/$defs/package"},
        "php-wasm": {
          "type": "object", "additionalProperties": false,
          "properties": {
            "npm": {
              "allOf": [
                {"$ref": "#/properties/targets/properties/npm"},
                {"properties": {"name": {"not": {"const": "@lean-bridge/php-wasm-copied-runtime"}}}}
              ]
            },
            "composer": {
              "type": "object", "additionalProperties": false,
              "properties": {
                "name": {"type": "string", "maxLength": 100, "pattern": "^[a-z][a-z0-9]*(?:[-_][a-z0-9]+)*/[a-z][a-z0-9]*(?:[-_][a-z0-9]+)*$(?![\\s\\S])"},
                "version": {"type": "string", "pattern": "^(0|[1-9][0-9]*)\\.(0|[1-9][0-9]*)\\.(0|[1-9][0-9]*)(?:-(?:alpha|beta|RC)\\.(?:0|[1-9][0-9]*))?$(?![\\s\\S])"}
              }
            }
          }
        },
        "wit-wasi": {"$ref": "#/$defs/package"}
      }
    }
  },
  "$defs": {
    "ownedAggregates": {
      "type": "object", "additionalProperties": false,
      "required": ["ownership", "disposal", "fallback", "cycles"],
      "properties": {
        "ownership": {"const": "lease"},
        "disposal": {"const": "required"},
        "fallback": {"enum": ["none", "queued-finalizer"]},
        "cycles": {"const": "reject"}
      }
    },
    "metadata": {
      "type": "object", "additionalProperties": false,
      "description": "Author-owned package metadata. Limits are UTF-8 byte counts; URLs must be HTTPS without credentials, queries or fragments. License expressions use listed SPDX 3.28 identifiers.",
      "properties": {
        "license": {"type": "string", "minLength": 1, "maxLength": 512, "pattern": "^[A-Za-z0-9(][A-Za-z0-9.()+ -]*[A-Za-z0-9)+]$(?![\\s\\S])", "description": "Validated against SPDX 3.28 nondeprecated identifiers and exceptions, including AND, OR, WITH and parentheses. No LicenseRef."},
        "licenseFiles": {"type": "array", "minItems": 1, "maxItems": 32, "uniqueItems": true, "items": {
          "type": "string", "maxLength": 512,
          "pattern": "^[A-Za-z0-9_-][A-Za-z0-9._ -]*(?:/[A-Za-z0-9_-][A-Za-z0-9._ -]*){0,15}$(?![\\s\\S])",
          "not": {"pattern": "[ .](?:/|$)|(?:^|/)(?:build|dist|target|node_modules|vendor|result)(?:/|$)"}
        }},
        "description": {"$ref": "#/$defs/metadataText", "maxLength": 512},
        "homepage": {"$ref": "#/$defs/metadataUrl"},
        "repository": {"$ref": "#/$defs/metadataUrl"},
        "authors": {
          "type": "array", "minItems": 1, "maxItems": 32, "uniqueItems": true,
          "items": {
            "type": "object", "additionalProperties": false, "required": ["name"],
            "properties": {
              "name": {"$ref": "#/$defs/metadataText", "maxLength": 128},
              "email": {"type": "string", "maxLength": 254, "pattern": "^[A-Za-z0-9.!#$%&'*+/=?^_`{|}~-]+@[A-Za-z0-9](?:[A-Za-z0-9.-]*[A-Za-z0-9])?\\.[A-Za-z]{2,63}$(?![\\s\\S])"},
              "url": {"$ref": "#/$defs/metadataUrl"}
            }
          }
        }
      }
    },
    "metadataText": {"type": "string", "minLength": 1, "pattern": "^\\S(?:[^\\u0000-\\u001f\\u007f-\\u009f\\u2028\\u2029\\ufffe\\uffff]*\\S)?$(?![\\s\\S])", "not": {"pattern": "[\\u0000-\\u001f\\u007f-\\u009f\\u2028\\u2029\\ufffe\\uffff]"}},
    "metadataUrl": {"type": "string", "maxLength": 1024, "pattern": "^https://[^/@\\s\\\\?#]+(?:/[^\\s\\\\?#]*)?$(?![\\s\\S])"},
    "contracts": {
      "type": "object", "maxProperties": 128,
      "propertyNames": {"$ref": "#/$defs/specializationName"},
      "additionalProperties": {
        "type": "object", "minProperties": 1, "additionalProperties": false,
        "properties": {
          "receiver": {"enum": ["method", "property"]},
          "parameters": {"type": "array", "maxItems": 1024, "items": {"$ref": "#/$defs/contractSite"}},
          "result": {"$ref": "#/$defs/contractSite"},
          "effects": {"type": "array", "uniqueItems": true, "items": {"enum": ["allocates", "reads-resource", "writes-resource", "fails", "host-call", "async", "nondeterministic"]}}
        }
      }
    },
    "contractSite": {
      "type": "object", "additionalProperties": false, "required": ["ownership", "lifetime"],
      "properties": {
        "ownership": {"enum": ["copy", "borrow", "lease", "transfer"]},
        "lifetime": {"oneOf": [{"type": "null"}, {"$ref": "#/$defs/contractLifetime"}]},
        "callable": {"$ref": "#/$defs/callableContract"},
        "refinement": {"oneOf": [
          {"const": "reject"},
          {"$ref": "#/$defs/checkedRefinementSelection"}
        ]}
      },
      "if": {"properties": {"ownership": {"const": "copy"}}},
      "then": {"properties": {"lifetime": {"type": "null"}}},
      "else": {"properties": {"lifetime": {"$ref": "#/$defs/contractLifetime"}}}
    },
    "checkedRefinementSelection": {
      "description": "Constructor choices only. Structural arguments use transport order, including [success, error] for result. Nominal selections name the exact record or variant and every field/case in source order. A null child selects no constructor and does not erase compiler-owned Fin bounds. The reader and fresh Lean enforce unique member names, 32 type edges and 4096 visited nodes. Selection syntax does not admit a runtime mapping.",
      "oneOf": [
        {"type": "object", "additionalProperties": false, "required": ["constructor"], "properties": {"constructor": {"$ref": "#/$defs/specializationName"}}},
        {
          "type": "object", "additionalProperties": false, "required": ["kind", "name", "constructor", "fields"],
          "properties": {
            "kind": {"const": "checked-record"},
            "name": {"$ref": "#/$defs/specializationName"},
            "constructor": {"$ref": "#/$defs/specializationName"},
            "fields": {"allOf": [{"$ref": "#/$defs/checkedNominalFields"}, {"minItems": 1}]}
          }
        },
        {
          "type": "object", "additionalProperties": false, "required": ["kind", "arguments"],
          "properties": {
            "kind": {"enum": ["array", "list", "option", "tuple", "result"]},
            "arguments": {
              "type": "array", "minItems": 1, "maxItems": 2,
              "items": {"oneOf": [{"type": "null"}, {"$ref": "#/$defs/checkedRefinementSelection"}]},
              "contains": {"not": {"type": "null"}}, "minContains": 1
            }
          },
          "if": {"properties": {"kind": {"enum": ["array", "list", "option"]}}},
          "then": {"properties": {"arguments": {"maxItems": 1}}},
          "else": {"properties": {"arguments": {"minItems": 2}}}
        },
        {
          "type": "object", "additionalProperties": false, "required": ["kind", "name", "fields"],
          "properties": {
            "kind": {"const": "record"},
            "name": {"$ref": "#/$defs/specializationName"},
            "fields": {"allOf": [{"$ref": "#/$defs/checkedNominalFields"}, {"$ref": "#/$defs/selectedNominalField"}]}
          }
        },
        {
          "type": "object", "additionalProperties": false, "required": ["kind", "name", "cases"],
          "properties": {
            "kind": {"const": "variant"},
            "name": {"$ref": "#/$defs/specializationName"},
            "cases": {
              "type": "array", "minItems": 1, "maxItems": 1024, "uniqueItems": true,
              "items": {
                "type": "object", "additionalProperties": false, "required": ["name", "fields"],
                "properties": {
                  "name": {"$ref": "#/$defs/checkedMemberName"},
                  "fields": {"$ref": "#/$defs/checkedNominalFields"}
                }
              },
              "contains": {"properties": {"fields": {"$ref": "#/$defs/selectedNominalField"}}}, "minContains": 1
            }
          }
        }
      ]
    },
    "checkedMemberName": {"type": "string", "pattern": "^[A-Za-z][A-Za-z0-9_]*$(?![\\s\\S])"},
    "selectedNominalField": {
      "contains": {"properties": {"refinement": {"not": {"type": "null"}}}}, "minContains": 1
    },
    "checkedNominalFields": {
      "type": "array", "maxItems": 1024, "uniqueItems": true,
      "items": {
        "type": "object", "additionalProperties": false, "required": ["name", "refinement"],
        "properties": {
          "name": {"$ref": "#/$defs/checkedMemberName"},
          "refinement": {"oneOf": [{"type": "null"}, {"$ref": "#/$defs/checkedRefinementSelection"}]}
        }
      }
    },
    "callableContract": {
      "type": "object", "additionalProperties": false, "minProperties": 1,
      "properties": {
        "parameters": {"type": "array", "maxItems": 16, "items": {"$ref": "#/$defs/contractSite"}},
        "result": {"$ref": "#/$defs/contractSite"}
      }
    },
    "contractLifetime": {
      "type": "object", "additionalProperties": false, "required": ["scope", "anchor"],
      "properties": {
        "scope": {"enum": ["call", "receiver", "parameter", "explicit", "runtime"]},
        "anchor": {"oneOf": [{"type": "null"}, {"const": "receiver"}, {"type": "string", "pattern": "^arg(0|[1-9][0-9]*)$(?![\\s\\S])"}]}
      },
      "if": {"properties": {"scope": {"const": "parameter"}}},
      "then": {"properties": {"anchor": {"type": "string", "pattern": "^arg(0|[1-9][0-9]*)$(?![\\s\\S])"}}},
      "else": {
        "if": {"properties": {"scope": {"const": "receiver"}}},
        "then": {"properties": {"anchor": {"const": "receiver"}}},
        "else": {"properties": {"anchor": {"type": "null"}}}
      }
    },
    "specializations": {
      "type": "array", "maxItems": 128,
      "items": {
        "type": "object", "additionalProperties": false,
        "required": ["name", "declaration", "types"],
        "properties": {
          "name": {"$ref": "#/$defs/specializationName"},
          "declaration": {"$ref": "#/$defs/specializationName"},
          "types": {"type": "array", "minItems": 1, "maxItems": 8, "items": {"$ref": "#/$defs/specializationName"}}
        }
      }
    },
    "specializationName": {"type": "string", "pattern": "^[A-Za-z][A-Za-z0-9_]*(\\.[A-Za-z][A-Za-z0-9_]*)*$(?![\\s\\S])"},
    "name": {"type": "string", "pattern": "^[A-Za-z][A-Za-z0-9_]*(\\.[A-Za-z][A-Za-z0-9_]*)*$"},
    "names": {"type": "array", "uniqueItems": true, "items": {"$ref": "#/$defs/name"}},
    "selection": {"allOf": [{"$ref": "#/$defs/names"}], "minItems": 1},
    "identifier": {"type": "string", "pattern": "^[A-Za-z0-9@][A-Za-z0-9_@./:+-]*$"},
    "package": {
      "type": "object",
      "additionalProperties": false,
      "properties": {
        "name": {"$ref": "#/$defs/identifier"},
        "version": {"$ref": "#/$defs/identifier"}
      }
    }
  }
}
