{
  "exports": [
    "NominalPrimitiveSubtypes.produce",
    "NominalPrimitiveSubtypes.produceGroup",
    "NominalPrimitiveSubtypes.producePair",
    "NominalPrimitiveSubtypes.produceEvent",
    "NominalPrimitiveSubtypes.produceChoices",
    "NominalPrimitiveSubtypes.wordBits"
  ],
  "modules": [
    "NominalPrimitiveSubtypes"
  ],
  "schemaVersion": 1,
  "targets": {
    "nuget": {
      "name": "Nominalprimitivesubtypes.Api",
      "version": "1.0.0"
    }
  }
}
