{
  "contracts": {
    "DependentRecords.dependentResult": {
      "parameters": [
        {
          "lifetime": null,
          "ownership": "copy"
        }
      ],
      "result": {
        "lifetime": null,
        "ownership": "copy"
      }
    },
    "DependentRecords.dependentRoundtrip": {
      "parameters": [
        {
          "lifetime": null,
          "ownership": "copy",
          "refinement": {
            "constructor": "DependentRecords.mkDependent",
            "fields": [
              {
                "name": "bound",
                "refinement": null
              },
              {
                "name": "below",
                "refinement": null
              }
            ],
            "kind": "checked-record",
            "name": "DependentRecords.Dependent"
          }
        }
      ],
      "result": {
        "lifetime": null,
        "ownership": "copy"
      }
    },
    "DependentRecords.dependentTotal": {
      "parameters": [
        {
          "lifetime": null,
          "ownership": "copy",
          "refinement": {
            "constructor": "DependentRecords.mkDependent",
            "fields": [
              {
                "name": "bound",
                "refinement": null
              },
              {
                "name": "below",
                "refinement": null
              }
            ],
            "kind": "checked-record",
            "name": "DependentRecords.Dependent"
          }
        }
      ],
      "result": {
        "lifetime": null,
        "ownership": "copy"
      }
    }
  },
  "exports": [
    "DependentRecords.dependentTotal",
    "DependentRecords.dependentRoundtrip",
    "DependentRecords.dependentResult"
  ],
  "modules": [
    "DependentRecords"
  ],
  "schemaVersion": 1,
  "targets": {
    "php-wasm": {
      "composer": {
        "name": "lean-bridge-dependentrecords/wasm",
        "version": "1.0.0"
      },
      "npm": {
        "name": "lean-bridge-dependentrecords-wasm",
        "version": "1.0.0"
      }
    }
  }
}
