{
  "contracts": {
    "NestedCheckedRecords.produceArray": {
      "parameters": [
        {
          "lifetime": null,
          "ownership": "copy"
        }
      ],
      "result": {
        "lifetime": null,
        "ownership": "copy"
      }
    },
    "NestedCheckedRecords.produceOption": {
      "parameters": [
        {
          "lifetime": null,
          "ownership": "copy"
        }
      ],
      "result": {
        "lifetime": null,
        "ownership": "copy"
      }
    }
  },
  "exports": [
    "NestedCheckedRecords.produceOption",
    "NestedCheckedRecords.produceArray"
  ],
  "modules": [
    "NestedCheckedRecords"
  ],
  "schemaVersion": 1,
  "targets": {
    "nuget": {
      "name": "Nestedcheckedrecords.Api",
      "version": "1.0.0"
    }
  }
}
